Questions,Answers,,
What is Artificial Intelligence?,Artificial Intelligence is an area of computer science that emphasizes the creation of intelligent machine that work and reacts like humans.,,
What is an artificial intelligence Neural Networks?,"Artificial intelligence Neural Networks can model mathematically the way biological brain works, allowing the machine to think and learn the same way the humans do- making them capable of recognizing things like speech, objects and animals like we do.",,
Give an explanation on the difference between strong AI and weak AI?,Strong AI makes strong claims that computers can be made to think on a level equal to humans while weak AI simply predicts that some features that are resembling to human intelligence can be incorporated to computer to make it more useful tools.,,
Mention the difference between statistical AI and Classical AI ?,"Statistical AI is more concerned with “inductive” thought like given a set of pattern, induce the trend etc.  While, classical AI, on the other hand, is more concerned with “ deductive” thought given as a set of constraints, deduce a conclusion etc.",,
 Which is the best way to go for Game playing problem?,"Heuristic approach is the best way to go for game playing problem, as it will use the technique based on intelligent guesswork. For example, Chess between humans and computers as it will use brute force computation, looking at hundreds of thousands of positions.",,
How is Machine Learning related to Artificial Intelligence?,"Artificial Intelligence is a technique that enables machines to mimic human behavior. Whereas, Machine Learning is a subset of Artificial Intelligence. It is the science of getting computers to act by feeding them data and letting them learn a few tricks on their own, without being explicitly programmed to do so",,
What is Q-Learning?,The Q-learning is a Reinforcement Learning algorithm in which an agent tries to learn the optimal policy from its past experiences with the environment. The past experiences of an agent are a sequence of state-action-rewards:,,
What is Deep Learning?,Deep learning imitates the way our brain works i.e. it learns from experiences. It uses the concepts of neural networks to solve complex problems.,,
 What are Bayesian Networks?," Bayesian network is a statistical model that represents a set of variables and their conditional dependencies in the form of a directed acyclic graph. On the occurrence of an event, Bayesian Networks can be used to predict the likelihood that any one of several possible known causes was the contributing factor.  For example, a Bayesian network could be used to study the relationship between diseases and symptoms. Given various symptoms, the Bayesian network is ideal for computing the probabilities of the presence of various diseases.",,
 Explain the assessment that is used to test the intelligence of a machine.,"In artificial intelligence (AI), a Turing Test is a method of inquiry for determining whether or not a computer is capable of thinking like a human being.",,
Explain reward maximization in Reinforcement Learning.,"The RL agent works based on the theory of reward maximization. This is exactly why the RL agent must be trained in such a way that, he takes the best action so that the reward is maximum.",,
What is exploitation and exploration trade-off?,"An important concept in reinforcement learning is the exploration and exploitation trade-off. Exploration, like the name suggests, is about exploring and capturing more information about an environment. On the other hand, exploitation is about using the already known exploited information to heighten the rewards.Consider the fox and tiger example, where the fox eats only the meat (small) chunks close to him but he doesn’t eat the bigger meat chunks at the top, even though the bigger meat chunks would get him more rewards. If the fox only focuses on the closest reward, he will never reach the big chunks of meat, this is called exploitation. But if the fox decides to explore a bit, it can find the bigger reward i.e. the big chunk of meat. This is exploration.",,
What are hyperparameters in Deep Neural Networks?,"Hyperparameters are variables that define the structure of the network. For example, variables such as the learning rate, define how the network is trained. They are used to define the number of hidden layers that must be present in a network. More hidden units can increase the accuracy of the network, whereas a lesser number of units may cause underfitting.",,
How does data overfitting occur,Overfitting occurs when a statistical model or machine learning algorithm captures the noise of the data. This causes an algorithm to show low bias but high variance in the outcome. ,,
Mention a technique that helps to avoid overfitting in a neural network.,Dropout is a type of regularization technique used to avoid overfitting in a neural network. It is a technique where randomly selected neurons are dropped during training. The Dropout value of a network must be chosen wisely. A value too low will result in a minimal effect and a value too high results in under-learning by the network.,,
" What is Data Science?
",,,"Data Science is  a  field  of  computer science that  explicitly deals  with  turning data  into information and extracting meaningful insights out of it. The reason why Data Science is so popular is that the kind of insights it allows us to draw from the available data has led to some major innovations in several products and companies. Using these insights, we are  able  to  determine  the  taste  of  a  particular  customer,  the  likelihood  of  a  product succeeding in a market."
Differentiate between Data Analytics and Data Science,,,"Data Analytics is a subset of Data Science. The goal of data analytics is to illustrate the precise details of retrieved insights. It requires just basic programming languages. It 
order to make decisions. It focuses on just finding the solutions. Data Science is a broad technology that includes various subsets such as Data Analytics, Data Mining, Data Visualization, etc. The goal of data science is to discover meaningful insights from massive dataset s and derive the best possible solutions to
resolve business issues. Requires knowledge in advanced programming languages. Data Science not only focuses on finding the solutions but also predicts the future with
past patterns or insights. A data scientist’s job is to provide insightful data visualizations from raw data that are easily understandable."
"What do you understand about linear regression?
",,,"Linear regression helps in understanding the linear relationship between the dependent and the independent variables. Linear regression is a supervised learning algorithm, which helps in finding the linear relationship between two variables. One is the predictor or the independent variable and the other is the response or the dependent variable. In Linear Regression,   we   try   to   understand   how  the   dependent   variable   changes   w.r.t   the independent variable. If there is only one independent variable, then it is called simple linear regression, and if there is more than one independent variable then it is known as"
What do you understand by logistic regression?,,,"
Logistic  regression is  a  classification  algorithm  that  can  be  used  when  the  dependent variable is binary. Let’s take an example. Here, we are trying to determine whether it will rain or not based on temperature and humidity."
What is Stemming & Lemmatization in NLP?,"Stemming algorithms work by cutting off the end or the beginning of the word, taking into account a list of common prefixes and suffixes that can be found in an inflected word. This indiscriminate cutting can be successful on some occasions, but not always. Lemmatization, on the other hand, takes into consideration the morphological analysis of the words. To do so, it is necessary to have detailed dictionaries which the algorithm can look through to link the form back to its lemma.

",,
How is Computer Vision and AI related?,"Computer Vision is a field of Artificial Intelligence that is used to obtain information from images or multi-dimensional data. Machine Learning algorithms such as K-means is used for Image Segmentation, Support Vector Machine is used for Image Classification and so on. Therefore Computer Vision makes use of AI technologies to solve complex problems such as Object Detection, Image Processing, etc.",,
Which is better for image classification? Supervised or unsupervised classification? Justify.,"In supervised classification, the images are manually fed and interpreted by the Machine Learning expert to create feature classes.",,
,"In unsupervised classification, the Machine Learning software creates feature classes based on image pixel values.",,
,,,
,"Therefore, it is better to choose supervised classification for image classification in terms of accuracy.",,
"Finite difference filters in image processing are very susceptible to noise. To cope up with this, which method can you use so that there would be minimal distortions by noise?","Image Smoothing is one of the best methods used for reducing noise by forcing pixels to be more like their neighbors, this reduces any distortions caused by contrasts.",,
How is Game theory and AI related?,"In the context of artificial intelligence(AI) and deep learning systems, game theory is essential to enable some of the key capabilities required in multi-agent environments in which different AI programs need to interact or compete in order to accomplish a goal.”",,
What is “Generality” in AI?,Generality is the measure of ease with which the method can be adapted to different domains of application.,,
What is a top-down parser?,A top-down parser begins by hypothesizing a sentence and successively predicting lower level constituents until individual pre-terminal symbols are written.,,
Mention the difference between breadth first search and best first search in artificial intelligence?,"These are the two strategies which are quite similar. In best first search, we expand the nodes in accordance with the evaluation function. While, in breadth first search a node is expanded in accordance to the cost function of the parent node.",,
What are frames and scripts in “Artificial Intelligence”?,"Frames are a variant of semantic networks which is one of the popular ways of presenting non-procedural knowledge in an expert system. A frame which is an artificial data structure is used to divide knowledge into substructure by representing “stereotyped situations’. Scripts are similar to frames, except the values that fill the slots must be ordered.  Scripts are used in natural language understanding systems to organize a knowledge base in terms of the situation that the system should understand.",,
What is FOPL stands for and explain its role in Artificial Intelligence?,"FOPL stands for First Order Predicate Logic, Predicate Logic provides A language to express assertions about certain “World”.   An inference system to deductive apparatus whereby we may draw conclusions from such assertion. A semantic based on set theory.",,
For online search in ‘Artificial Intelligence’ which search agent operates by interleaving computation and action?,"In online search, it will first take action and then observes the environment.",,
Which search algorithm will use a limited amount of memory in online search?,RBFE and SMA* will solve any kind of problem that A* can’t by using a limited amount of memory.,,
In ‘Artificial Intelligence’ where you can use the Bayes rule?,"In Artificial Intelligence to answer the probabilistic queries conditioned on one piece of evidence, Bayes rule can be used.",,
For building a Bayes model how many terms are required?,"For building a Bayes model in AI, three terms are required; they are one conditional probability and two unconditional probability.",,
What is the consequence between a node and its predecessors while creating bayesian network?,"While creating Bayesian Network, the consequence between a node and its predecessors is that a node can be conditionally independent of its predecessors.",,
To answer any query how the Bayesian network can be used?,"If a Bayesian Network is a representative of the joint distribution, then by summing all the relevant joint entries, it can solve any query.",,
What combines inductive methods with the power of first order representations?,Inductive logic programming combines inductive methods with the power of first order representations.,,
In Inductive Logic Programming what needed to be satisfied?,The objective of an Inductive Logic Programming is to come up with a set of sentences for the hypothesis such that the entailment constraint is satisfied.,,
Which algorithm inverts a complete resolution strategy?,"‘Inverse Resolution’ inverts a complete resolution, as it is a complete algorithm for learning first order theories.",,
In speech recognition what kind of signal is used?,"In speech recognition, Acoustic signal is used to identify a sequence of words.",,
In speech recognition which model gives the probability of each word following each word?,Biagram model gives the probability of each word following each other word in speech recognition.,,
What is Hidden Markov Model (HMMs) is used?,Hidden Markov Models are a ubiquitous tool for modelling time series data or to model sequence behaviour.  They are used in almost all current speech recognition systems.,,
"In HMM, where does the additional variable is added?","While staying within the HMM network, the additional state variables can be added to a temporal model.",,
" In Artificial Intelligence, what do semantic analyses used for?","In Artificial Intelligence, to extract the meaning from the group of sentences semantic analysis is used.",,
What is meant by compositional semantics?,"The process of determining the meaning of P*Q from P,Q and* is known as Compositional Semantics.",,
Which process makes different logical expression looks identical?,‘Unification’ process makes different logical expressions identical.  Lifted inferences require finding substitute which can make a different expression looks identical.  This process is called unification.,,
Which is the most straight forward approach for planning algorithm?,State space search is the most straight forward approach for planning algorithm because it takes account of everything for finding a solution.,,
What do you understand by Artificial Intelligence?,"Artificial intelligence is computer science technology that emphasizes creating intelligent machine that can mimic human behavior. Here Intelligent machines can be defined as the machine that can behave like a human, think like a human, and also capable of decision making. It is made up of two words, ""Artificial"" and ""Intelligence,"" which means the ""man-made thinking ability.""

With artificial intelligence, we do not need to pre-program the machine to perform a task; instead, we can create a machine with the programmed algorithms, and it can work on its ow",,
Why do we need Artificial Intelligence?,"The goal of Artificial intelligence is to create intelligent machines that can mimic human behavior. We need AI for today's world to solve complex problems, make our lives more smoothly by automating the routine work, saving the manpower, and to perform many more other tasks.",,
What do you understand by the reward maximization?,"Reward maximization term is used in reinforcement learning, and which is a goal of the reinforcement learning agent. In RL, a reward is a positive feedback by taking action for a transition from one state to another. If the agent performs a good action by applying optimal policies, he gets a reward, and if he performs a bad action, one reward is subtracted. The goal of the agent is to maximize these rewards by applying optimal policies, which is termed as reward maximization.",,
"What Are Intelligent Agents, and How Are They Used in AI?","Intelligent agents are autonomous entities that use sensors to know what is going on, and then use actuators to perform their tasks or goals. They can be simple or complex and can be programmed to learn to accomplish their jobs better. ",,
"What Is Tensorflow, and What Is It Used For?","TensorFlowis an open-source software library initially developed by the Google Brain Team for use in machine learning and neural networks research. It is used for data-flow programming. TensorFlow makes it much easier to build certain AI features into applications, including natural language processing and speech recognition. ",,
"What Is Machine Learning, and How Does It Relate to AI? ",Machine learning is a subset of AI. The idea is that machines will “learn” and get better at tasks over time rather than having humans continually having to input parameters. Machine learning is a practical application of AI. ,,
"What Are Neural Networks, and How Do They Relate to AI? ","Neural networks are a class of machine learning algorithms. The neuron part of the neural is the computational component, and the network part is how the neurons are connected. Neural networks pass data among themselves, gathering more and more meaning as the data moves along. Because the networks are interconnected, more complex data can be processed more efficiently.",,
Why Is Image Recognition a Key Function of AI?,"Humans are visual, and AI is designed to emulate human brains. Therefore, teaching machines to recognize and categorize images is a crucial part of AI. Image recognition also helps machines to learn (as in machine learning) because the more images that are processed, the better the software gets at recognizing and processing those images. ",,
What Is Automatic Programming?,"Automatic programming is describing what a program should do, and then having the AI system “write” the program.",,
What Are Constraint Satisfaction Problems?,"Constraint Satisfaction Problems (CSPs) are mathematical problems defined as a set of objects, the state of which must meet several constraints. CSPs are useful for AI because the regularity of their formulation offers commonality for analyzing and solving problems. ",,
What Is Supervised Versus Unsupervised Learning?,"Supervised learning is a machine learning process in which outputs are fed back into a computer for the software to learn from, for more accurate results the next time. With supervised learning, the “machine” receives initial training to start. In contrast, unsupervised learning means a computer will learn without initial training to base its knowledge.",,
What role does computer vision play in AI?,"Artificial intelligence (AI) is broken down into a number of subfields, one of which is known as computer vision. Computer vision is the process of teaching computers to understand and collect data from the visual environment, such as graphics. Therefore, AI technology is used by computer vision in order to address complicated challenges such as image analysis, object identification, and other similar issues.",,
Where does Artificial Intelligence go from here?,"It is anticipated that artificial intelligence will continue to have a significant impact on a large number of people as well as almost every sector. Artificial intelligence has become the primary impetus behind the development of new technologies such as robots, the Internet of Things, and large data sets. AI is capable of making an ideal judgment in a split second, which is almost difficult for a person to do. Cancer treatment, cutting-edge global climate solutions, smart transportation, and space research are all being aided by AI. We don't expect it to renounce its position as the driving force behind computer innovation and progress any time soon. Artificial Intelligence will have a greater influence on the globe than any other technological advancement in human history.",,
" What do you comprehend by the phrase ""reward maximization""?","Reinforcement learning uses the phrase ""reward maximization"" to describe the purpose of the agent, which is to maximize rewards. Real-world rewards are positive feedback for doing an action that results in a change in a state. A reward is given to the agent if he uses optimum policies to complete a good deed, and a reward is deducted if he fails to do so. Rewards are maximized by using the best rules possible, which is known as reward maximization.",,
What is your comprehension of hyperparameters?,"The training process is controlled by hyperparameters. Model train performance is directly influenced by these factors, which may be changed to one's liking. They are made known in advance. Algorithm hyperparameters that have no influence on simulation results but can influence the efficiency and acquisition of skills are the other two categories of hyperparameters that may be inferred when accommodating the machine to the learning algorithm.",,
What is a Chatbot?,"A chatbot is a computer program with artificial intelligence (AI) that can converse with humans using natural language processing. The communication may take place on a website, via an application, or through one of the several messaging applications. These chatbots, which are often referred to as digital assistants, are capable of interacting with people either via the exchange of text or by voice commands. The majority of companies now make extensive use of AI chatbots in order to provide round-the-clock, virtual customer service to their clientele.",,
What is the future of Artificial Intelligence?,"Artificial Intelligence has affected many humans and almost every industry, and it is expected to continue to do so. Artificial Intelligence has been the main driver of emerging technologies like the Internet of Things, big data, and robotics. AI can harness the power of a massive amount of data and make an optimal decision in a fraction of seconds, which is almost impossible for a normal human. AI is leading areas that are important for mankind such as cancer research, cutting-edge climate change technologies, smart cars, and space exploration. It has taken the center stage of innovation and development of computing, and it is not ceding the stage in the foreseeable future. Artificial Intelligence is going to impact the world more than anything in the history of mankind.",,
Explain cost function.," A cost function is a scalar function that helps identify how wrong an AI model is with regard to its ability to determine the relationship between X and Y. In other words, it tells us the neural network’s error factor. The neural network works better when the cost function is lower. For instance, it takes the output predicted by the neural network and the actual output and then computes how incorrect the model was in its prediction. So, the cost function will give a lower number if the predictions don’t differ too much from the actual values and vice-versa.",,
Explain vanishing gradient.,"As more layers are added and the distance from the final layer increases, backpropagation is not as helpful in sending information to the lower layers. As a result, the information is sent back, and the gradients start disappearing and becoming small in relation to network weights.",,
Mention the steps of the gradient descent algorithm.,"The gradient descent algorithm helps in optimization and in finding coefficients of parameters that help minimize the cost function. The steps that help achieve this are as follows: Step 1: Give weights (x,y) random values and then compute the error, also called SSE Step 2: Compute the gradient or the change in SSE when you change the value of the weights (x,y) by a small amount. This step helps us identify the direction in which we must move x and y to minimize SSE. Step 3: Adjust the weights with the gradients for achieving optimal values for the minimal SSE. Step 4: Change the weights for predicting and calculating the new error. Step 5: Repeat steps 2 and 3 till the time making more adjustments stops producing significant error reduction.",,
"What is the difference between Artificial Intelligence, Machine Learning, and Deep Learning?","DL is a subset of ML, which is the subset of AI. Hence, AI is the all-encompassing concept that initially erupted in computer science. It was then followed by ML that thrived later, and lastly DL, that is now promising to escalate the advances of AI to another level.",,
 Name some popular programming languages in AI.,"R, python lisp, prolog, java",,
 Name some popular programming languages in AI.,An expert system is an Artificial Intelligence program that has an expert-level knowledge about a specific area of data and its utilisation to react appropriately. These systems tend to have the capability to substitute a human expert. ,,
What is the Tower of Hanoi?,"Tower of Hanoi essentially is a mathematical puzzle that displays how recursion is utilised as a device in building up an algorithm to solve a specific problem. The Tower of Hanoi can be solved using a decision tree and a breadth-first search (BFS) algorithm in AI. With 3 disks, a puzzle can essentially be solved in 7 moves. However, the minimal number of moves required to solve a Tower of Hanoi puzzle is 2n − 1, where n is the number of disks.",,
