Questions,Answers,,
What is an A* Algorithm search method?,"A* is a computer algorithm in AI that is extensively used for the purpose of finding paths or traversing graphs – to obtain the most optimal route between nodes. It is widely used in solving pathfinding problems in video games. Considering its flexibility and versatility, it can be used in a wide range of contexts. A* is formulated with weighted graphs, which means it can find the best path involving the smallest cost in terms of distance and time. This makes A* an informed search algorithm for best-first search.",,
What is a breadth-first search algorithm?,"BFS algorithm is used to search tree or graph data structures. It starts from the root node, proceeds through neighbouring nodes, and finally moves towards the next level of nodes. Till the arrangement is found and created, it produces one tree at any given moment. As this pursuit is capable of being executed by utilising the FIFO (first-in, first-out) data structure, this strategy gives the shortest path to the solution.",,
What is a Depth-first Search Algorithm?,"Depth-first search (DFS) is an algorithm that is based on LIFO (last-in, first-out). Since recursion is implemented with LIFO stack data structure, the nodes are in a different order than in BFS. The path is stored in each iteration from root to leaf nodes in a linear fashion with space requirement.",,
What is fuzzy logic?,Fuzzy logic is a subset of AI. It is a way of encoding human learning for artificial processing. It is represented as IF-THEN rules. ,,
What is Ensemble Learning?,"Ensemble learning is a computational technique in which classifiers or experts are strategically formed and combined. It is used to improve classification, prediction, and function approximation of any model.",,
Explain tree topology?,"As the name suggests, “Tree” topology has several connected elements arranged like the branches of a tree. The structure has at least three specific levels in the hierarchy. These are scalable and accessible while troubleshooting and are so preferred. A common drawback in this topology is the hindrance or malfunctioning of the primary node.",,
Explain Karl Pearson’s coefficient of correlation?,Karl Pearson’s correlation coefficient is a measure of the strength of a linear association between two variables. It is denoted by r or rxy (where x and y are the two variables involved). This method of correlation draws a line of best fit through the data of two variables.,,
How to select the best hyperparameters in a tree-based model?,Measure the performance over validation data.,,
How would you describe ML to a non-technical person?,"ML is geared toward pattern recognition. A great example of this is your Facebook newsfeed and Netflix’s recommendation engine. In this scenario, ML algorithms observe patterns and learn from them. When you deploy an ML program, it will keep learning and improving with each attempt.",,
What’s selection bias? What other types of biases could you encounter during sampling?,"When you’re dealing with a non-random sample, selection bias will occur due to flaws in the selection process. This happens when a subset of the data is consistently excluded because of a particular attribute. This exclusion will distort results and influence the statistical significance of the test. Other types of biases include survivorship bias and undercoverage bias. It’s important to always consider and reduce such biases because you’ll want your smart algorithms to make accurate predictions based on the data.",,
What’s an eigenvalue? What about an eigenvector?,"The directions along which a particular linear transformation compresses, flips, or stretches is called eigenvalue. Eigenvectors are used to understand these linear transformations. For example, to make better sense of the covariance of the covariance matrix, the eigenvector will help identify the direction in which the covariances are going. The eigenvalues will express the importance of each feature. Eigenvalues and eigenvectors are both critical to computer vision and ML applications.",,
"Would you use batch normalization? If so, can you explain why?","The idea here is to standardize the data before sending it to another layer. This approach helps reduce the impact of previous layers by keeping the mean and variance constant. It also makes the layers independent of each other to achieve rapid convergence. For example, when we normalize features from 0 to 1 or from 1 to 100, it helps accelerate the learning cycle.",,
When is it necessary to update an algorithm?,You should update an algorithm when the underlying data source has been changed or whenever there’s a case of non-stationarity. The algorithm should also be updated when you want the model to evolve as data streams through the infrastructure.,,
What would you do if data in a data set were missing or corrupted?,"Whenever data is missing or corrupted, you either replace it with another value or drop those rows and columns altogether. In Pandas, both isNull() and dropNA() are handy tools to find missing or corrupted data and drop those values. You can also use the fillna() method to fill the invalid values in a placeholder—for example, “0.”",,
"What is transfer learning, and how does it compare to a neural architecture approach?","Transfer learning is a process wherein the learning from an already developed model is resued and built upon for a new task. Essentially, it is using pre-trained models and customizing them for your use case.",,
How do you choose an algorithm for solving artificial intelligence and machine learning issues?,"Before choosing an algorithm for solving artificial intelligence and machine learning issues, I try to identify the issue completely. This helps me to understand the situation to a greater extent. It then allows me to determine the most suitable input and the algorithm. For solving the issue completely, it is necessary to choose an algorithm that is accurate, scalable and simple in nature. For me, it is important to finish the project within the time frame so I focus on analysing the data first and then choose the algorithm accordingly depending on training and build time.",,
What is simulated annealing Algorithm?,"The process is of heating and cooling a metal to change its internal structure. Although, for modifying its physical properties is known as annealing. As soon as the metal cools, it forms a new structure. Also, metal is going to retain its newly obtained properties. Although, we have to keep the variable temperature in a simulated annealing process. First, we have to set high temperature. Then, left it to allow “cool” slowly with the proceeding algorithm. Further, if there is high temperature, algorithm accepts worse solutions with high frequency.",,
What is Natural Language Processing?,We use English language to communicate between an intelligent system and N.L.P. Processing of Natural Language plays an important role in various systems.,,
What is Fuzzy Logic Implementation?,"Basically, it can be implemented in systems with various sizes and capabilities. That should be range from mall micro-controllers to large. Also, it can be implemented in hardware, software, or a combination of both in AI.",,
What are Expert Systems in AI?,"We can say these are computer applications. Also, with the help of this development, we can solve complex problems. It has level of human intelligence and expertise.",,
 Give a brief introduction to robotics?,"Basically, robots have their specific aim. As they manipulate the objects. For Example-  by perceiving, picking, moving, modifying the physical properties of an object.",,
How are artificial intelligence and machine learning different from one another?,"Machine learning and deep learning are the sub-sets of artificial intelligence. While AI is a smart operating system that uses the cognitiobn abilities of a human brain to solve complex problems, machine learning is a computer system that allows machines to learn from the data collected by surveys, among other things. Artificial intelligence processes are concerned with maximizing the chances of success. Meanwhile, machine learning’s main concern is accuracy and pattern, not success.",,
What are some of the popular AI domains?,"The answer to this artificial intelligence interview question will include machine learning, neutral networks, robotics, expert systems, fuzzy logic systems, and natural language processing. These popular sub-sets or domains of artificial intelligence have gained prominence in the last decade.",,
Which is better for image classification? Supervised or unsupervised classification? Justify.,"In supervised classification, the images are manually fed and interpreted by the Machine Learning expert to create feature classes. In unsupervised classification, the Machine Learning software creates feature classes based on image pixel values. Therefore, it is better to choose supervised classification for image classification in terms of accuracy.",,
"inite difference filters in image processing are very susceptible to noise. To cope up with this, which method can you use so that there would be minimal distortions by noise?","Image Smoothing is one of the best methods used for reducing noise by forcing pixels to be more like their neighbors, this reduces any distortions caused by contrasts.",,
What is a Confusion Matrix? How does it work?,"A confusion matrix is ​​a specific table that is commonly used to measure the performance of an algorithm. It is mostly used in supervised learning; in unsupervised learning, it's called the matching matrix. It has two parameters actual and predicted.",,
